_id,productName,price.mrp,price.cost,price.discountPercent,subcategory,productImage,category,description,tagline,quantity,seller,createdAt,updatedAt,__v,reviews[0].rating,reviews[0].comment,reviews[0].reviewer,reviews[0].date,reviews[0]._id
662feab04c9d3436552fb3d1, Sonalika Tractor,1000,850,25,Rental Equipments,https://assets.tractorjunction.com/tractor-junction/assets/images/images/oldTractor/oldtractor-1702374485-0.jpeg,Rental Equipments,"Product Description\n\nExperience the power and reliability of the Sonalika tractor, designed to tackle any farming task with ease. Our rental package offers you access to top-of-the-line machinery without the hassle of ownership. The Sonalika tractor boasts advanced features, including robust engines for optimal performance, ergonomic design for operator comfort, and superior traction for various terrains. Whether plowing fields, hauling loads, or tilling soil, this versatile machine delivers exceptional efficiency and productivity. With our flexible rental terms and competitive rates, you can elevate your farming operations without breaking the bank. Trust Sonalika for your agricultural needs and witness unparalleled performance in action.\n\n", Sonalika Tractor,1,662b71ba9ab72c5a6d14023f,2024-04-29T18:45:04.442Z,2024-04-29T18:45:04.442Z,0,,,,,
662fec3a4c9d3436552fb3d3," Sonalika 33x39 PTO Double Wheel Bumper Model, Coupleen Self-Feed (Krishi Samrat)",1000,900,25,Rental Equipments,https://assets.tractorjunction.com/tractor-junction/assets/images/images/implementTractor/33x39-pto-double-wheel-bumper-model-coupleen-self-feed-krishi-samrat-66-1674555909.webp?format=webp,Rental Equipments,Product Description\nIt is used for Harvesting\n\n," Sonalika 33x39 PTO Double Wheel Bumper Model, Coupleen Self-Feed (Krishi Samrat)",1,662b71ba9ab72c5a6d14023f,2024-04-29T18:51:38.801Z,2024-04-29T18:51:38.801Z,0,,,,,
6654124f803483efef082f77,Ameecal Super Gold Gel Mineral Mixture Increases Milk Yield & Calcium Level,1300,1000,10,animal Feed,https://agripari.com/wp-content/uploads/2021/01/Ameecal-super-plus-gold-gel.jpeg,Animal Husbandry,"Description\n\n1. Prevents milk fever & associated complication.\n\n2. Increases milk yield, favours the normal contraction of uterus, normal calving & timely expulsion of the placenta.\n\n3. Highly useful in prolapse cases.\n\n4. Provides five times more calcium than I/V calcium injection.\n\n5. Ensures rapid and efficient absorption of calcium and enhances serum calcium level within 15 min. of oral administration maintains serum calcium level longer than I/V calcium therapy.\n\n",Ameecal Super Gold Gel Mineral Mixture Increases Milk Yield & Calcium Level,1,662b71ba9ab72c5a6d14023f,2024-05-27T04:55:43.552Z,2024-05-27T04:55:43.552Z,0,,,,,
6654136d803483efef082f79,"Supermin Shakti Gold Glycine Powder, Mineral Mixture, For The Improved Fertility",350,300,5,animal Feed,https://agripari.com/wp-content/uploads/2021/01/SUPERMIN-SHAKTI-GOLD-POWDER.png,Animal Husbandry,Description\n\nBENEFITS : \n\n1. Increases milk production\n2.  For improved fertility\n3.  Achieve peak production early\n4. Prolonged & maintain lactation period\n5. Prevents sudden drop in milk\n6. Relieves from all kind stress\n7. Increases milk protein & health of animal\n8.  Improving the general health of animal\n9. Better metabolic activity & higher productivity\n\nDOSAGE :\nLARGE ANIMALS	40-50 GM DAILY\nSMALL ANIMALS	25-35 GM DAILY,"Supermin Shakti Gold Glycine Powder, Mineral Mixture, For The Improved Fertility",1,662b71ba9ab72c5a6d14023f,2024-05-27T05:00:29.879Z,2024-05-27T05:00:29.879Z,0,,,,,
665413d4803483efef082f7b,"Supermin Gold Methomin Powder , Mineral Mixture, For improved fertility And Increasing Milk Production",350,270,6,animal Feed,https://agripari.com/wp-content/uploads/2023/10/Supermin-gold-Methomin-chelaated.jpeg,Animal Husbandry,Description\n\nBENEFITS:\n\n1. Increases milk production\n2. For improved fertility\n3. Achieve peak production early\n4. Prolonged & maintain lactation period\n5. Prevents sudden drop in milk\n6. Relieves from all kind of stress\n7. Increases milk protein & health of animal\n8. Improving the general health of animal\n9. Better metabolic activity & higher productivity\nDOSAGE\nLARGE ANIMALS	40-40 GM DAILY\nSMALL ANIMALS	25-35 GM DAILY,"Supermin Gold Methomin Powder , Mineral Mixture, For improved fertility And Increasing Milk Production",1,662b71ba9ab72c5a6d14023f,2024-05-27T05:02:12.178Z,2024-05-27T05:02:12.178Z,0,,,,,
6654142d803483efef082f7d,"Masti Cure Powder, Mineral Mixture For Prevention And Better Control Of Mastitis",470,400,8,animal Feed,https://agripari.com/wp-content/uploads/2021/01/Masti.jpeg,Animal Husbandry,Description\n\nBENEFITS : \n1. Prevention & better control of mastitis\n\n2. Powerful combination for fibrosis & mastitis\n\n3. Fast relief\n\n4. Accurate composition\n\n5. No side effect\n\n6. Milk disorders\n\nDOSAGE:\n15 GM  TWO TIMES IN DAY,"Masti Cure Powder, Mineral Mixture For Prevention And Better Control Of Mastitis",1,662b71ba9ab72c5a6d14023f,2024-05-27T05:03:41.184Z,2024-05-27T05:03:41.184Z,0,,,,,
