_id,productName,price.mrp,price.cost,price.discountPercent,subcategory,productImage,category,description,tagline,quantity,seller,createdAt,updatedAt,__v,reviews[0].rating,reviews[0].comment,reviews[0].reviewer,reviews[0].date,reviews[0]._id
662e1fb64a4c414982f5eb45,MERA 71 HERBICIDE,152,114,38,Herbicides,https://cdn.shopify.com/s/files/1/0722/2059/products/71herbicide.jpg?v=1671532501,Herbicides,"Product Description\nAbout Product\nExcel Mera 71 is a systemic, broad-spectrum, non-selective, post-emergent, herbicide.\nExcel Mera 71 gives complete and speedy control of hard to kill annual and perennial weeds.\nQuicker & Higher absorption - Faster in absorption by weeds and quicker in action than any other systemic herbicides of its class.\nExcel Mera 71 Herbicide Technical Details\nTechnical Content: Ammonium salt of Glyphosate 71% SG\nMode of Entry: Systemic Herbicide\nMode of Action: Mera 71 is absorbed on foliage application through green plant parts and is translocated rapidly throughout the plant to roots and storage organs. Mera 71 activity is by blocking the activity of the enzyme enolpyruvyl-shikimate-3 phosphate synthase (EPSPS) causing deficiency in aromatic amino acids: phenylalanine, tyrosine and tryptophan leading to plant death by starvation.\nKey Features and Benefits\nQuicker & Higher absorption.\nFaster kill as compared to IPA salt.\nHigher loading (active ingredient) per liter.\nBetter control of Broad leaf and hard to kill weeds.\nBetter rain fastness.\nCost-effective weed management.",MERA 71 HERBICIDE,1,662b71ba9ab72c5a6d14023f,2024-04-28T10:06:46.688Z,2024-04-28T10:06:46.688Z,0,,,,,
662e20ee4a4c414982f5eb7c,AGIL HERBICIDE,500,214,57,Herbicides,https://cdn.shopify.com/s/files/1/0722/2059/products/1_2_82138792-34c6-491b-9e92-e9babd9c97b9.webp?v=1671449710,Herbicides,"Product Description\nABOUT PRODUCT\nAgil Herbicide is a herbicide of the aryloxyphenoxy propionates family. It is used for the post-emergence control of a wide range of annual and perennial grasses.\nAgil is used for selective weed control in many broadleaf crops such as sugarbeet, oilseed rape, soybeans, sunflower, other field crops, vegetables, fruit trees, vineyards and forestry and best result is achieved when sprayed at the 2-4 leaf stage.\nAgil Herbicide is a systemic herbicide, which is quickly absorbed by the leaves and translocated from the foliage to the growing points of the leaves and roots of the sprayed weeds.\nRainfall 1 hour after application will not affect the product activity. Optimal activity is achieved when applied early and weeds are actively growing.\nAgil Herbicide is safe for beneficial insects and mammals and is environmentally friendly.\nTECHNICAL CONTENT\nPropaquizafop 10% EC\n\nFEATURES\nRainfall 1 hour after application will not affect the product activity. Optimal activity is achieved when applied early and weeds are actively growing.\nAGIL is safe to beneficial insects and mammals and is environmentally friendly.",AGIL HERBICIDE,1,662b71ba9ab72c5a6d14023f,2024-04-28T10:11:58.395Z,2024-04-29T08:51:33.353Z,1,3,this product is nice and work within a day i suggest to all ,662e97618b4efe6f529510f4,2024-04-29T08:51:33.344Z,662f5f958628548395eebd04
662e213f4a4c414982f5eb7e,SEMPRA HERBICIDE,281,229,19,Herbicides,https://cdn.shopify.com/s/files/1/0722/2059/products/4_bd3ad653-2283-4098-aa9f-1d13b22b22b8.webp?v=1671630228,Herbicides,"Product Description\nABOUT PRODUCT\nAgil Herbicide is a herbicide of the aryloxyphenoxy propionates family. It is used for the post-emergence control of a wide range of annual and perennial grasses.\nAgil is used for selective weed control in many broadleaf crops such as sugarbeet, oilseed rape, soybeans, sunflower, other field crops, vegetables, fruit trees, vineyards and forestry and best result is achieved when sprayed at the 2-4 leaf stage.\nAgil Herbicide is a systemic herbicide, which is quickly absorbed by the leaves and translocated from the foliage to the growing points of the leaves and roots of the sprayed weeds.\nRainfall 1 hour after application will not affect the product activity. Optimal activity is achieved when applied early and weeds are actively growing.\nAgil Herbicide is safe for beneficial insects and mammals and is environmentally friendly.\nTECHNICAL CONTENT\nPropaquizafop 10% EC\n\nFEATURES\nRainfall 1 hour after application will not affect the product activity. Optimal activity is achieved when applied early and weeds are actively growing.\nAGIL is safe to beneficial insects and mammals and is environmentally friendly.",SEMPRA HERBICIDE,1,662b71ba9ab72c5a6d14023f,2024-04-28T10:13:19.057Z,2024-04-28T10:13:19.057Z,0,,,,,
662e8dd08b4efe6f52950fd8,FERIO HERBICIDE,1304,759,42,Herbicides,https://cdn.shopify.com/s/files/1/0722/2059/products/1_12.webp?v=1671451237,Herbicides,"Product Description\nABOUT PRODUCT\nFERIO IS A NON-SELECTIVE, POST EMERGENT HERBICIDE USED FOR THE CONTROL OF PERENNIAL WEEDS IN PLANTATION CROPS.\nFERIO HAS GOT BROAD-SPECTRUM EFFICACY THAT CAN CONTROL BROAD LEAF AND GRASSY WEEDS.\nFERIO IS CONTACT HERBICIDE, ON BE SAFE TO THE CROP SPRAY HOOD MAY BE USED TO AVOID SPILL OF DRIFT ON CROPS.\nFERIO CAUSES NO HARM TO SOIL AND WATER.",FERIO HERBICIDE,1,662b71ba9ab72c5a6d14023f,2024-04-28T17:56:32.433Z,2024-04-28T17:56:32.433Z,0,,,,,
662e8e4f8b4efe6f52950fda,SWEEP POWER HERBICIDE,635,383,40,Herbicides,https://cdn.shopify.com/s/files/1/0722/2059/products/AGS-CP-786_1.webp?v=1682314097,Herbicides,"Product Description\nABOUT PRODUCT\nA new generation non-selective Herbicide, Very effective on hard to kill weeds and safe to applicator when used as per recommended protective spray.\nTECHNICAL CONTENT\nGlufosinate Ammonium 13.5% W/W SL\nFEATURES & BENEFITS\nFeatures\n\nBroad spectrum, non – selective, post emergent herbicide\nNo known weed resistance D36",SWEEP POWER HERBICIDE,1,662b71ba9ab72c5a6d14023f,2024-04-28T17:58:39.355Z,2024-04-28T17:58:39.355Z,0,,,,,
662e8ebe8b4efe6f52950fdc,NOMINEE GOLD HERBICIDE,704,499,29,Herbicides,https://cdn.shopify.com/s/files/1/0722/2059/files/AGS-CP-985_1.webp?v=1688730233,Herbicides,"Product Description\nABOUT PRODUCT\nNominee Gold Herbicide is a post-emergent, Broad Spectrum systemic herbicide for all types of Rice cultivation i.e. direct sown rice, rice nursery, and transplanted rice.\nTECHNICAL CONTENT\nBispyribac Sodium 10% SC\nFEATURES\nNominee Gold controls major grasses, Sedges, and broad leaf weeds of rice.\n\nNominee Gold offers a wide application window from 2-5 leaf stages of weeds.\n\nIt gives freedom of need-based application only when the weeds emerge.\n\nIt is safe for rice.\n\nIt gets absorbed quickly in weeds and results are unaffected even if it rains after 6 hours of application.\n\nNominee Gold has a low dosage of 80-120 ml/acre\n\nIt is safe for the environment.\n\nIt is cost-effective.\n\nUSAGE\nMode Of Action\n\nInhibition of acetolactate synthase ALS (acetohydroxyacid synthase AHAS).\nApplication:\n\n\nShake the bottle well before the well\n\nTargeted weeds should directly be exposed to NOMINEE GOLD spray\n\nUse Flat fan / Flood jet nozzle only\n\nEnsure uniform spray only\n\nAvoid Spray if rain is expected in 6 hrs.\n\nRe-flood the field within 48 - 72 hrs. of application.\n\nMaintain water for 5-7 days to suppress weed emergence.",NOMINEE GOLD HERBICIDE,1,662b71ba9ab72c5a6d14023f,2024-04-28T18:00:30.013Z,2024-04-28T18:00:30.013Z,0,,,,,
662e8f298b4efe6f52950fde,WEEDMAR 80 Herbicide,256,220,14,Herbicides,https://cdn.shopify.com/s/files/1/0722/2059/products/Artboard1copy4-2_1_b6126940-f03d-4a11-90d7-e342ce249223.webp?v=1674798173,Herbicides,"Product Description\nWeedmar Super (2,4-D Amine Salt 58% SL) and Weedmar are the selective, systemic weedicides of Phenoxyacetic group.\nTECHNICAL CONTENT\n2,4D Sodium Technical 80%\n\nFEATURES & BENEFITS\nFEATURES\nApart from effectively controlling broad leaf weeds, these also control the Cyperus sp.\nThere is no adverse effect on crops with recommended dose of Weedmar or Weedmar Super.\n",WEEDMAR 80 Herbicide,1,662b71ba9ab72c5a6d14023f,2024-04-28T18:02:17.026Z,2024-04-28T18:02:17.026Z,0,,,,,
662e8fd58b4efe6f52950fe0,SAAHO TOMATO SEEDS [TO-3251],1450,999,31,Tomato,https://cdn.shopify.com/s/files/1/0722/2059/products/Sahoo.jpg?v=1671198625,Seeds,"Product Description\nFEATURES\nDeterminate Plant\nGood Stay greenness\nDark green foliage\nGood Heat set\nVery Good Firm Fruits\nHigh Yield potential\n\nCHARACTERISTICS\nYield- Average yield: 25-40 MT/acre ( depending on season and cultural practice)\nSize- Round Shape\nShape- Flat Round type, uniform green\nWeight- 80-100g",SAAHO TOMATO SEEDS [TO-3251],1,662b71ba9ab72c5a6d14023f,2024-04-28T18:05:09.062Z,2024-04-28T18:05:09.062Z,0,,,,,
662e905d8b4efe6f52950fe2,SURABHI CORIANDER,250,208,17,Coriander,https://cdn.shopify.com/s/files/1/0722/2059/products/CORIANDAR-NS-SURABHI-500-GM.jpg?v=1680156641,Seeds,"Product Description\nSurabhi is a vigorous variety of coriander having excellent yield potential. Suitable for multiple cuts with very attractive, large, shiny leaves with having good aroma. It is a late-bolting variety and can be grown around the year.\n\nUSAGE\nFEATURES:\nType - multi-cut\nStalk height- 20 25 cm\nFoliage color- Dark green\nMATURITY: 35 days after sowing.\n",SURABHI CORIANDER,1,662b71ba9ab72c5a6d14023f,2024-04-28T18:07:25.137Z,2024-04-28T18:07:25.137Z,0,,,,,
662e90cb8b4efe6f52950fe4,212 BRINJAL SEEDS,200,175,13,Brinjal,https://cdn.shopify.com/s/files/1/0722/2059/files/14_128680d2-bb12-4cfd-8376-f9c2872b128f.webp?v=1689403884,Seeds,"Product Description\nKey Features:\nVNR 212 Brinjal Seeds is very high yielding early maturing hybrid seeds.\nIt fetches good market price due to attractive fruit colour & shine\n \n\nVNR 212 Brinjal Seeds Characteristics:\nBearing Type: Cluster bearing & continuous fruiting\nFruit Colour: Dark violet fruit with purplish calyx\nFruit Shape: Oblong\nFruit Weight: 100 to 150 gms\nFruit Size: Length 9.5-10.5 cm, Width 4.5-5.5cm",212 BRINJAL SEEDS,1,662b71ba9ab72c5a6d14023f,2024-04-28T18:09:15.990Z,2024-04-28T18:09:15.990Z,0,,,,,
662e91438b4efe6f52950fe6,KRISH F1 CUCUMBER,432,299,31,Cucumber,https://cdn.shopify.com/s/files/1/0722/2059/products/VNR_Krish_Cucumber.jpg?v=1652075661,Seeds,"Product Description\n\nABOUT PRODUCT\nFirst Harvest- 30-35 Days\nSeed Quantity Per Acre-0.180-0.250 kgs\nSowing Distance Between Row and Ridges-4-6 Feet\nSowing Distance Between Plants-1.5-2 Feet\nFEATURES & BENEFITS\nFEATURES\nColour - Green\nFruit Size-Length - 18-20 Cms\nFruit Size-Width - 3.5-4 Cms\nFruit Weight - 1500-200 Gms\nBENEFITS\nEarly hybrid & early bulker with high yield potential\nGood for long distant transporatation\nDesi type, crisp fresh fruits\nUniform fruits after multiple pickings too\nUSAGE\nRECOMMENDATIONS: Good nutrient Mgt. advised from early stage of plant",KRISH F1 CUCUMBER,1,662b71ba9ab72c5a6d14023f,2024-04-28T18:11:15.451Z,2024-04-28T18:11:15.451Z,0,,,,,
662e91eb8b4efe6f52950fe8,RAADHIKA BHINDI,2540,1700,33,Bhendi,https://cdn.shopify.com/s/files/1/0722/2059/products/Artboard1copy9-15.png?v=1674468474,Seeds,"Product Description\n\nABOUT PRODUCT\n\nIt is a hybrid variety of okra.\nSuitable for round the year\nshelf life of fruit is long\n\nSPECIFICATIONS\n\nMedium Plant Height with 2-4 branches.\nFruits are very closely packed, With dark green color, soft texture\nLength of the fruit is 12 to 14cm and width is 1.5 to1.8 cm\nThe first harvesting of fruits is done within 45-50 days, and there is enhanced production.\nMedium tolerance to YVMV and ELCV",RAADHIKA BHINDI,1,662b71ba9ab72c5a6d14023f,2024-04-28T18:14:03.719Z,2024-04-28T18:14:03.719Z,0,,,,,
662e92638b4efe6f52950fea,NAMDHARI AFRICAN MARIGOLD DOUBLE ORANGE SEEDS,360,210,42,Marigold,https://cdn.shopify.com/s/files/1/0722/2059/files/12_9991414f-269e-4e38-9502-e4d43113d8fa.webp?v=1689403812,Seeds,"Product Description\n\nCultivation Instruction For Marigold Seeds\n\nNursery Practice:\nBring the soil of nursery beds to a fine texture and mix well rotten compost along with the small proportion of fine sand. Make grooves 7-8cm apart to a depth of 0.50cm on the plain beds. Sow the seeds in these grooves and cover them with a thin layer of compost. Water the beds with 'Captan' solution [3g/litre] and cover with\nnewspaper sheets. Seeds start germination in 4-6 days. At this stage, the newspaper sheets have to be removed preferably during evening hours. Seeds can be sown plug trays with coir peat too to get seedlings with the root ball. After germination, the plants would be ready for transplanting to flower beds or big pots in three weeks time.\n\nGrowing Instruction:\n\nAfter transplanting the seedlings to beds or pots, fertilizer application in solution form [1g of 17:17:17 N:P:K/liter] has to be followed for better growth plants. The first dose can be started from the 10th day after transplanting. Drenching with 'Bavistin' or 'Ridomil' at 1.50 g/liter, once in 15 days is advised during the rainy season to protect the plants from fungal diseases. To keep the sucking insects at bay alternate spraying of 'Dimethoate' and 'Monocrotohos' at 1ml/litre at 15 days intervals would be sufficient.\n\nSowing Season:\n\nIn mild climates, Marigolds can be grown around the year with slightly better care during the summer months. In the plains of south India Marigolds can be grown around the year. In central and north India marigolds can be sown in June-August and January-February and grown successfully.",NAMDHARI AFRICAN MARIGOLD DOUBLE ORANGE SEEDS,1,662b71ba9ab72c5a6d14023f,2024-04-28T18:16:03.386Z,2024-04-28T18:16:03.386Z,0,,,,,
662e93448b4efe6f52950fec,Red Lady Papaya Seeds,1052,968,8,Papaya,https://cdn.shopify.com/s/files/1/0722/2059/products/Red-Lady.jpg?v=1680779545,Seeds,"Product Description\n\nRed Lady Papaya Seeds from Known You is early, vigorouctive, as, prodund tolerant to papaya ringspot virus\nPlants begin to bear fruit at 60-80 cm height and have over 30 fruits per plant in each fruit-setting season\nFruits are short oblong on female plants and rather long-shaped on bisexual plants, weighing about 1.5-2 kg\nThe flesh is thick, red, with 13% sugar content, and aromatic\nGood shelf life and transportability\nSeason - Kharif, Rabi and Early summer\n10 Gm= 550-600 Seeds\n\n2gm= 100-120 Seeds",Red Lady Papaya Seeds,1,662b71ba9ab72c5a6d14023f,2024-04-28T18:19:48.914Z,2024-04-28T18:19:48.914Z,0,,,,,
662f7cfbd5d25d3bc2cb732e,LIHOCIN GROWTH REGULATOR,495,400,19,Growth Regulators,https://cdn.shopify.com/s/files/1/0722/2059/products/download.webp?v=1678450204,Growth Regulators,"Product Description\n\nAbout Product\nLihocin Growth Regulator used in various crops to channelize plant growth, enhance yield, and improve the quality of produce.\nIt is recommended for reducing vegetative growth while increasing the reproductive system of the plant.\nLihocin Growth Regulator Technical Details\nTechnical Content: Chlormequat Chloride 50% SL\nMode of Action: Lihocin is a PGR that contains chlormequat chloride, which blocks the synthesis of gibberellins, a hormone that stimulates plant growth. By lowering the gibberellin levels, Lihocin limits the plant’s height and directs its energy and resources to flower and fruit production. This enhances the yield and quality of the crops by making the fruits and vegetables bigger and heavier.\nKey Features and Benefits\nLihocin Growth Regulator reducing vegetative growth & enhancing reproductive growth.\nImproves the quality of produce by increasing the size and weight of fruits and vegetables.\nLihocin contains chloromequat chloride, which inhibits the production of gibberellins, a plant hormone responsible for promoting growth.\nBy reducing vegetative growth and promoting flowering and fruiting, Lihocin optimizes the plant’s energy allocation",LIHOCIN GROWTH REGULATOR,1,662b71ba9ab72c5a6d14023f,2024-04-29T10:56:59.502Z,2024-04-29T10:56:59.502Z,0,,,,,
662f7d6fd5d25d3bc2cb7330,HOSHI GIBBERELLIC ACID,999,658,34,Growth Regulators,https://cdn.shopify.com/s/files/1/0722/2059/products/1_45.webp?v=1672654989,Growth Regulators,"Product Description\nAbout Product\nSumitomo Hoshi is an organic solution designed to enhance plant growth.\nIt boosts the metabolism of plants, leading to vigorous and healthy crops.\nIt fulfils the micronutrient requirements of plants.\nHoshi Gibberellic Acid Technical Details\nTechnical Content: Gibberellic Acid 0.001% L",HOSHI GIBBERELLIC ACID,1,662b71ba9ab72c5a6d14023f,2024-04-29T10:58:55.687Z,2024-04-29T10:58:55.687Z,0,,,,,
662f7ddfd5d25d3bc2cb7332,HIFIELD AG GIBRAX PHYTOZYME GROWTH REGULATOR,310,256,17,Growth Regulators,https://cdn.shopify.com/s/files/1/0722/2059/products/w2oyii81Wh.jpg?v=1620892660,Growth Regulators,"Product Description\nAbout Product\nGibrax Phytozyme is a growth regulator product from Hifield AG.\nIt is designed to promote cell elongation, which in turn can increase the size of fruits, flowers, and enhance the overall growth of plants.\nAdditionally, it boosts the immunity of crops and contributes to an increase in yield.\nHifield Ag Gibrax Phytozyme Technical Details\nTechnical Content: Gibberellic Acid 0.001% L + Seaweed + Micronutrients + Amino Acid\nKey Features & Benefits\nUse of GIBRAX PHYTOZYME can lead to an increase in the immunity of crops, which in turn contributes to a higher yield.\nIt contains gibberellic acid, seaweed, micronutrients, and amino acid, which work",HIFIELD AG GIBRAX PHYTOZYME GROWTH REGULATOR,1,662b71ba9ab72c5a6d14023f,2024-04-29T11:00:47.121Z,2024-04-29T11:00:47.121Z,0,,,,,
662f7e3cd5d25d3bc2cb7334,CHAMATKAR GROWTH REGULATOR,510,350,31,Growth Regulators,https://cdn.shopify.com/s/files/1/0722/2059/files/gharda_chamatkar.png?v=1688969238,Growth Regulators,Product Description\nMepiquat Chloride 5% aqueous Solution is used in agriculture as a plant growth regulator. It is used for the control of excessive vegetative growth and to increase crop yield in potato and cotton.\nTECHNICAL CONTENT\nMEPIQUAT CHLORIDE 5% AQUEOUS SOLUTION,CHAMATKAR GROWTH REGULATOR,1,662b71ba9ab72c5a6d14023f,2024-04-29T11:02:20.111Z,2024-04-29T11:02:20.111Z,0,,,,,
662f7ed0d5d25d3bc2cb7336,SAAF FUNGICIDE,111,99,11,Fungicides,https://cdn.shopify.com/s/files/1/0722/2059/products/Saaf.webp?v=1680086906,Fungicides,"Product Description\nAbout Product\nSAAF Fungicide is one among the most trusted fungicide in India.\nIt is a proven & classic fungicide with systemic & contact action.\nIt ensures complete protection of the crop from fungal infections.\nUPL Saaf has long-lasting efficacy against a wide range of crops and diseases.\nSAAF Fungicide Technical Details\nTechnical Content: Carbendazim 12% + Mancozeb 63% WP\nMode of Entry: Both Systemic & Contact\nMode of Action: SAAF fungicide, contains carbendazim and mancozeb, works as a dual mode of action against fungi. Carbendazim acts systemically, spreads throughout the plant tissues and targets the fungal cells ability to multiply. Mancozeb works by contact action and creates a barrier on the plant surface and stops the fungal spores from infecting the plant.",SAAF FUNGICIDE,1,662b71ba9ab72c5a6d14023f,2024-04-29T11:04:48.913Z,2024-04-29T11:04:48.913Z,0,,,,,
662f7f17d5d25d3bc2cb7338,INDOFIL M45 FUNGICIDE,182,181,1,Fungicides,https://cdn.shopify.com/s/files/1/0722/2059/products/indofil.jpg?v=1680086309,Fungicides,"Product Description\nAbout Product\nSAAF Fungicide is one among the most trusted fungicide in India.\nIt is a proven & classic fungicide with systemic & contact action.\nIt ensures complete protection of the crop from fungal infections.\nUPL Saaf has long-lasting efficacy against a wide range of crops and diseases.\nSAAF Fungicide Technical Details\nTechnical Content: Carbendazim 12% + Mancozeb 63% WP\nMode of Entry: Both Systemic & Contact\nMode of Action: SAAF fungicide, contains carbendazim and mancozeb, works as a dual mode of action against fungi. Carbendazim acts systemically, spreads throughout the plant tissues and targets the fungal cells ability to multiply. Mancozeb works by contact action and creates a barrier on the plant surface and stops the fungal spores from infecting the plant.",INDOFIL M45 FUNGICIDE,1,662b71ba9ab72c5a6d14023f,2024-04-29T11:05:59.644Z,2024-04-29T11:05:59.644Z,0,,,,,
662f7f76d5d25d3bc2cb733a,BAVISTIN FUNGICIDE,200,158,21,Fungicides,https://cdn.shopify.com/s/files/1/0722/2059/products/Artboard1copy5-2_1.webp?v=1674039738,Fungicides,Product Description\n\nAbout Product\nBavistin Fungicide is the most trusted brand in the agrochemical industry.\nBavistin fungicide is a broad-spectrum systemic fungicide effective against a wide range of pathogenic fungi.\nBavistin has broader disease control in field and horticultural crops.\nBavistin Fungicide works as preventive as well as curative hence giving longer duration of control.\nBavistin has quicker action in field and horticulture crops.\nBavistin Fungicide Technical Details\nTechnical Content: Carbendazim 50% WP\nMode of Entry: Systemic fungicide\nMode of Action: Preventive and Curative action\nKey Features and Benefits\nBavistin Fungicide is a Broad- spectrum systemic fungicide.\nIt is effective in all stages of crop growth and effective against a wide range of pathogenic fungi as it is having preventive & curative action.\nBavistin is a systemic fungicide that controls disease at every growing point of the plant.,BAVISTIN FUNGICIDE,1,662b71ba9ab72c5a6d14023f,2024-04-29T11:07:34.668Z,2024-04-29T11:07:34.668Z,0,,,,,
662f7fd9d5d25d3bc2cb733c,RIDOMIL GOLD FUNGICIDE,269,231,14,Fungicides,https://cdn.shopify.com/s/files/1/0722/2059/files/krisikart.com-2022-12-19T223508.278_11zon-e1674582118975.jpg?v=1691049048,Fungicides,"Product Description\n\nAbout Product\n\nRidomil Gold Fungicide is a combi product that can help you protect your crops from fungal diseases.\nDue to hyper-systemic uptake and translocation properties, Ridomil Gold SL protects vegetables, citrus, potatoes and tree nuts from soilborne oomycete diseases (including late blight and Downy mildew).\nRidomil Gold Fungicide also improves stand, root health and crop vigor and has flexible application methods and a clear, easy-to-use formulation.\nIt is a fast-acting fungicide.\nRidomil Gold Fungicide Technical Details\nTechnical Content: Metalaxyl 4%+Manconzeb 64%\nMode of Entry: Contact fungicide\nMode of Action: Metalaxyl – M (Acylalanine) inhibits protein synthesisby intererence with the synthesis of ribosomal RNA and Mancozeb (Dithiocarbamate) exhibits multisite contact activity.",RIDOMIL GOLD FUNGICIDE,1,662b71ba9ab72c5a6d14023f,2024-04-29T11:09:13.741Z,2024-04-29T11:09:13.741Z,0,,,,,
662f8048d5d25d3bc2cb733e,AMISTAR TOP FUNGICIDE,749,581,22,Fungicides,https://cdn.shopify.com/s/files/1/0722/2059/products/1_28.webp?v=1672057806,Fungicides,"Product Description\n\nAbout Product\n\nAmistar Top Fungicide is a fungicide product from Syngenta, it is used to control a range of fungal diseases in crops such as vegetables, rice, cotton, potatoes, citrus, and tree nuts.\nIt offers preventive and curative activity and has a broad-spectrum and long-duration effect.\nAmistar Top Fungicide is known to positively influence the crop yield and quality, as well as help the plant to fight better against the abiotic stress and better utilisation of the nutrients provided.\nAmistar Top is fast acting fungicide which has long duration control.\nAmistar Top Fungicide Technical Details\nTechnical Content: Azoxystrobin 18.2% + Difenoconazole 11.4% SC\nMode of Entry: Systemic fungicide\nMode of Action: Amistar Top Fungicide is a fungicide that contains two active ingredients: azoxystrobin and difenoconazole. Azoxystrobin inhibits spore germination at the early stages of fungal development, thus preventing the invasion of fungal pathogens. Difenoconazole interferes with the biosynthesis of ergosterol, a vital component of fungal cell membranes, thus disrupting the growth and reproduction of fungi. Together, these two ingredients provide a broad spectrum of control against various fungal diseases in crops.",AMISTAR TOP FUNGICIDE,1,662b71ba9ab72c5a6d14023f,2024-04-29T11:11:04.958Z,2024-04-29T11:11:04.958Z,0,,,,,
662f80aad5d25d3bc2cb7340,CONTAF PLUS FUNGICIDE,260,162,38,Fungicides,https://cdn.shopify.com/s/files/1/0722/2059/products/1_4_3dea9b7d-8145-4dae-9735-9ce27dff01b4.webp?v=1671708929,Fungicides,"Product Description\nABOUT PRODUCT\nSterol biosynthesis inhibitior.\nTECHNICAL CONTENT\nHexaconazole 5% SC\nFEATURES\nContaf plus is a broad-spectrum systemic fungicide having protective, curative and antisporulant activity.\nIt provides phytotonic effect with longer duration of disease control.\nIt is a safer formulation having rain fastness effect.",CONTAF PLUS FUNGICIDE,1,662b71ba9ab72c5a6d14023f,2024-04-29T11:12:42.744Z,2024-04-29T11:12:42.744Z,0,,,,,
662f80ffd5d25d3bc2cb7342,NATIVO FUNGICIDE,180,110,39,Fungicides,https://cdn.shopify.com/s/files/1/0722/2059/products/1_4_0e1a9088-d5be-4092-94fa-e023e1a25fc8.webp?v=1671454530,Fungicides,"Product Description\nAbout Product\nNativo Fungicide is a new combination fungicide and controls fungal diseases in various crops.\nIt is a systemic broad-spectrum fungicide with protective and curative action.\nNativo Fungicide enhances crop quality and production.\nIt demonstrates quick mesostemic action (good penetration and re-distribution).\nNativo Fungicide Technical Details\nTechnical Content: Tebuconazole 50%+ Trifloxystrobin 25% w/w WG (75 WG)\nMode of Entry: Protective and curative action entry\nMode of Action: Tebuconazole is dimethylase inhibitor (DMI) -interferes in the process of building the structure of fungal cell wall. Finally, it inhibits the reproduction and further growth of fungus. Trifloxystrobin interferes with respiration in plant pathogenic fungi.",NATIVO FUNGICIDE,1,662b71ba9ab72c5a6d14023f,2024-04-29T11:14:07.856Z,2024-04-29T11:14:07.856Z,0,,,,,
